TRIAL,CONVERSATION
58,let's have a look at the Sony a6000 it takes pictures almost as good as itself and professional cameras in some situations it can be accepted for print publication is that good but it's only $550 supported the price the top professional camera so great pictures interchangeable lenses but some compromises
58,um yeah actually I think that's a more my type of come out but what are those compromises
58,first it's a mirrorless camera so it's a bit like having an extra element in the length of the light is going to pass through one more thing before it reaches the sensor.  Also also it has no pulp mode serve the slowest shutter speed on here is 30 seconds but that's your limit you can't go to bulb mode and keep it open for an hour or two
58,I think that's alright for me yeah yeah that's pretty much what I'm going to use it for but how much does it cost again
58,this is only $550 and it comes with a basic lens already dilating to seventy Zoom
58,very good and can I use also other lenses with it
58,it's this wide range of lenses to go with this camera and more being devised all the time we have a brochure that describes those
58,okay thank you I will take a look at that and then I'll let you know thank you very much for helping me anytime
58,anytime any questions come in anytime and we'll see you later have a good afternoon
