TRIAL,CONVERSATION
24,understand I travel a lot myself and I never know what I'm going to see so I try to have a camera that will respond to what I see when I see it
24,this sony camera has full manual control but you can scented soap works almost like a pointed shirt very easy to use
24,does it have any preset mode sets
24,has nine basic preset modes that deal with different situations like beach or snow on my portrait
24,what about the price
24,it's $550 and it takes the same top quality pictures as camera costing full time that makes it ideal for travel especially when you go to interesting new places
24,is it heavy
24,please pick it up and say
24,it's a bit heavy
24,this is about 500 grams we have a much lighter camera over here. The nikon
24,it seems very practical
24,very lightweight it has excellent picture quality the sensor is 20 megapixels it's basically a point and shoot camera
24,does it come in other color option
24,we have purple pink black silver and red
24,this this is good
24,we have them in stock right now as you like to look around the rest of the cameras
24,okay thanks
24,thank you for your time have a good afternoon
25,good afternoon how can I help you
25,I'm looking for a camera for taking pictures in concerts
25,tricky will you be using flash
25,I prefer not
25,I understand so you would also need to be up to have very close control over exposure
25,yeah that's true
25,the canon is really only one kind of camera that will work for you. it gives you full creative control so that gives you full exposure control.
25,justice do well on that environment
25,in concert you might have big hot spots of light when you actually need quiet if I shut its speed or it could be very dim but you need a high ISO. this is the best camera on the market for that environment the voice of top professionals for concert shooting
25,how about the autofocus. 
25,you have 61 autofocus points some cameras have more but this has more modes for how it talks about those points and how it thinks about them
25,ISO option is
25,6400 ISO which is excellent but then sometimes your lens will have different settings that might affect that
25,thank you for your help
25,thank you have a good afternoon
26,the afternoon how can I help today
26,why do you have a camera with the fool creative control
26,yes we do we have the Canon 5d Mark 3 you may have heard about it
26,yeah I wanted to see that
26,here it is a very excited about it I've taken it out twice myself now and take in some nature pictures with running water
26,is the quality good
26,the quality is the best this is how are the cameras attached
26,what about it
26,you probably already understand about some of the intand stabilisation
26,what about  explosure and  ISO
26,the static shutter speed is 30 seconds if I so it goes up to 6400
26,that sounds pretty nice how much does it cost
26,this particular body is $2000 
26,thanks for your time
26,thank you have a good afternoon
27,excuse me
27,yes how can I help you
27,what color do you have for the canon
27,we have three colors black white and gray
27,what is the price of this camera
27,that one cost $2000
27,what about weight
27,that was pretty heavy it's 950 grams
27,what is the price of this nikon camera
27,that one cost 550 I'm sorry that one for $68
27,it is in red color
27,yes we do have to read for the camera
27,how much is this sony
27,that one cost $550
27,expensive
27,thank you very much
27,you're welcome
28,yes how can I help you
28,the sensor size of this camera canon.
28,it has a full frame sensor
28,is this long exposure
28,Yes it can be explosive to three seconds end if you want it also have both mode
28,how fast is a performance
28,the is a performance for this a half up to 6400 and he has very little noise
28,whoat about the optical zoom.
28,it has 5 times optical zoom
28,what is the size of this sony camera
28,for that though it has an API aps-c sensor
28,what about explosure
28,it's for until 30 seconds of exposure
29,welcome
29,excuse me
29,yes ma'am how can I help you
29,do you have this nikon in black color
29,yes we actually have four different colors black grey pink and red
29,camera to take family pictures
29,are you experienced in using cameras
29,not much
29,"I think this camera will be the perfect cover for you. it's a has a very it has a lot of auto settings. it has many types  modes, like 18, so if you go on traveling with your family then it will Auto adjusts itself"
29,how much it weights
29,as you can see it's quite light is 120 grams
29,how much it cost?
29,it is affordable is the $68
29,do you have this sony in a red color
29,no we don't have red color for this one
29,what color do you have
29,for this one we have read I'm sorry for this one we have grey and black only
29,how many modes
29,distance houses and more yes it has risen up and has 9 preset mode for every weather condition and it also have manual control
29,how much is this
29,is this because it has also manual control it cause a bit more it costs $550
29,550 dollars too expensive for me
29,i recommend the previous camera
29,thank you very much
30,how can I help you today
30,I'm looking for a lightweight camera
30,if you need a light with camera I can show you this nikon one
30,what does this support for preset mode
30,yes it has 18 preset modes and it has four inches of this world has no one
30,how much is this
30,it's only $68
30,it is black out this sony camera
30,yes we do have black colour it comes in three different colors white silver and black
30,it has preset modes
30,No it has two different mosaic. It has manual setting but it's also have recycling
30,how much?
30,this one cost a bit more because it has also manual settings and it's pretty life it's 470 gram is $550
30,I am serching for a point and shoot camera
30,"are you looking for a point and shoot camera for daily use. I recommend you to the previous camera, nikon, which has of preset mode and very easy to use"
30,it also comes in many colors and it's pretty cheap for $68
30,thank you for your support
31,help me 
31,yes madam
31,I'm looking for a camera for outdoor shooting this nikon is how is it good for outdoor shooting
31,if you're looking for a this. It has 20 preset mode for every situation including Beach mode and no more and I. So it's good for outdoor shooting 
31,comes up with long exposure
31,no it doesn't if you're looking at a shooting at night I recommend you this sony camera
31,synthesize of this camera
31,it has an aps-c sensor and it also supports up to 30 seconds long exposure so it's very good for outdoor shooting
31,what about iso
31,Is 3200 little noise aside from that it's also has preset mode if for each condition for outdoor shooting
31,what about this canon camera?
31,This one is a full manual camera so it also was forced long exposure and it's good for authorship
31,ISO performers
31,this one it goes under 6400 is on
31,thank you very much
31,you're welcome
32,excuse me
32,how can I help you
32,sony camera support for preset mod
32,it sports a 9 different types of preset modes including a beach snow and for night portrait
32,what color do you have
32,this one comes in three colors white silver and black
32,I'm looking for the red color what do you have any
32,for this camera we don't have red color camera. for the nikon camera we do have red color
32,let's see
32,this one comes in 5 different color purple pink black silver and red also it comes in 18 defense visit mom
32,I don't have that much experience is this good for me
32,traffic camera for a beginner user because you don't have to adjust anything. It is automatic.
32,how much is this canon
32,that one's $2000 professional camera with manual center console
32,thank you for the support
32,yes you're welcome
33,help me 
33,yes madam
33,this canon suports preset modes 
33,this camera is a full manual camera so it doesn't have any preset mode
33,I can recommend you the nikon for a camera with preset mode. It has 18 different to chose. It converts to be easy to use.
33,what colors do you have
33,this one comes in 5 different colors red purple pink pink
33,how much is this
33,this one costs $68
33,ant his other sony has preset modes
33,it has some preset modes and also manual mode and it has 9 different presets
33,is this heavy
33,as you can see it yourself it's a 470 grams so it's not really heavy
33,thisonly on black color 
33,yes we do we have black color also other colors are white and silver
33,okay thanks
33,thank you for visiting our store
34,excuse me
34,yes madam
34,synthesize of this sony camera
34,aps-c sensor
34,how is the ISO performance
34,it goes up to 3200 that I was lying test very little noise
34,supposed to long exposure
34,explosure up to 30 seconds of Life sculpture and it says it has also a high ISO it's very good for nitrogen 
34,there are other camera with full outdoor shooting
34,yes we do have other camera for outdoor shooting but this canon is a full manual camera
34,what is a synthesize
34,"I do not know, let me check."
34,how much is this
34,just got it costs $2000
34,bye
34,bye
35,excuse me. This canon has preset mode
35,it is a manual camera if you're looking up for a preset point and shoot camera that I can show you the nikon
35,how many preset modes
35,this one has 18 different people in one at a squirtle moves everything
35,do you have black color
35,yes we do we have 5 different colors black red purple pink and silver
35,seems lightweight. what is the weight of this camera
35,it's light as you said it's very light and only 120 grams and it's easy to be to put in your pocket
35,how much is this
35,this one is very cheap $68
35,and waht about this sony
35,this needs an Experience user
35,not high experience user. it is for medium experienced because it has a seven preset modes but this is for intermediate user because it also have some manual settings
35,how much is this
35,this one cost $550
35,what colors do you have
35,that's why we have white silver and black
35,thank you very  much
35,you're welcome
36,excuse me
36,yes ma'am
36,is this canon whole manual camera
36,yes it is it's a full manual camera and it's so so full frame camera
36,is this supposed following exposure
36,it south has 52 seconds exposure  and about that it also supports both know so he can hold it for sure for as long as you want
36,how is the ISO performance
36,with a really high asset income cell with a 6400 ISO settings and it has very little noise for that amount of highest
36,how much is this
36,it is 3000 dollars
36,is there any other low price camera
36,"more a cheaper cover up that it also has manual settings, we have this sony"
36,what is the sensor of size
36,aps-c sensor which is not full frame but it's enough to shoot outdoor shooting
36,how much is this
36,Is $550 but you don't have to buy extra lenses for this one
36,thank you for your support
36,you are welcome
37,excuse me
37,yes how can I help you
37,this sony is a full manual camera
37,I know it has manual settings but I also have some preset mode
37,what does sensor size
37,the sensor size for this one is that a has an aps-c sensor
37,whart about iso
37,how far this one goes up to 3200 ISO levels
37,is there any other manual cameras
37,"yes i can show you the other full manual camera, a canon"
37,what about ISO performance
37,this one it goes up to 6400 ISO
37,exposure
37,"I can not guess the  exposure, we should check"
38,excuse me
38,yes madam
38,size of performance of this canon camera
38,6400 ISO with very little money
38,is this full manual 
38,this is full manual
38,size
38,what's a full frame camera
38,"and what about this sony, ISO"
38,they want it supposed to 3200 ISO
38,is this one manual
38,who has manual mode but I also have preset modes. Is semi-automatic
38,thank you for your support
38,no problem
39,excuse me
39,yes how can I help you
39,I'm looking for daily use camera
39,easy to use camera. It will be the nikon
39,do you have black color
39,yes it has a black color
39,and in purple
39,"yes we have a purple, I think, as over red and black"
39,and how much about this sony
39,"the previous camera,  is the cheapest so we have it is $68"
39,is this sony good for daily use
39,yes it has 9 different preset mode so it's really easy to use and also has manual settings
40,excuse me
40,yes how can I help you
40,this nikon has support for basic mode
40,"yes, it has 18 different things that most"
40,how about the weight
40,it is also very light
40,black color
40,yes we do have that color and aside from that perfectly pink silver and red
40,how much is this 
40,this one cost $68
40,how much is this sony camera
40,this one is $550
40,is this easy to use
40,it has 6 preset modes so it's easy to use but if you want to adjust the settings manually can also do that
40,what are the Colours
40,this one comes in white silver and black
40,okay
40,please let me know if you have any other questions
41,excuse me
41,yes
41,sensor size of this canon camera
41,full frame camera of size 34 mm x 25 mm
41,is it manual
41,yes it is
41,iso performance
41,it has a really high ISO which is 6400
41,"and what about this sony, is this supported to long exposion"
41,"yes, it has loong explosure of 40 secs"
41,what about the sensor
41,it's an aps-c sensor
41,thank you very much for your support
41,thank you for coming to our store
42,excuse me
42,how can I help you today
42,is this sony a long exposure
42,I am not sure. 
42,does it matter. I want a manual camera
42,"this is not manual, We have the canond which is full manual"
42,how is the iso performance
42,it has a really high ISO which is 6400 and its has very little noise 
42,okay
42,if you have any other questions just please call me
43,excuse me. is there any other colors of this nikon camera
43,it has 5 different colors purple pink black silver and red
43,how much is this
43,has 18 different preset modes so you don't need to buy just a second and just the series automatically
43,how much is this sony camera
43,that is $550
43,preset mode
43,yes it has 9 different preset modes and some artistic as a gas well
43,it's heavy how much is it
43,oh yes it's actually 470 grams
43,ok
43,if you need anything else please call me
44,excuse me. Do you have red color for this nikon
44,yes we do have red color for the camera
44,how much is this
44,this one is $68
44,it's easy to use
44,is full automatic cover on it and it has 18 different preset mode
44,it is good for beginers
44,is very good for a beginner user
44,and how much is this sony camera
44,this one cost $550
44,is there any other colors
44,colors black white and silver
44,thank you for your support
44,thank you for coming to our store
45,excuse me
45,yes how may I help you
45,canon supports for long exposure
45,Actually it does. it supports up to three seconds of exposure
45,user performance
45,it goes up to 6400 levels with really loud noise nothing
45,other manual setting camera
45,oh yes this one this  only for manual. There we have a siny that it a semi manual camera as well
45,ok let's see
45,this camera supports manual settings but also has some preset mode. Up to 5.
45,what is a performance
45,it has 3200 levels of iso
45,and what about the sensor size
45,it has aps-c sensor
45,thanks i will look around
45,ask me if you need any more help
46,excuse me
46,yes how can I help you
46,how much is this nikon
46,the 68 dollars
46,is there any other colors
46,comes with in purple pink black silver and red
46,how much weight
46,as you can feel yourself is very life it's only 120 grams
46,good. And how much about this sony
46,I am not sure…
46,it's easy to use
46,yes it has 9 different preset mode for automatic settings but you can also set it manually
46,what are the colors do you have
46,it comes in silver white and black
46,ok
46,see you soon
47,may I help you
47,how many colors do you have in this canon camera
47,there's only one color for this camera black to black too
47,just black ok. And what is the weight for this camera
47,just a body only is 950 grams and you have to buy extra lense
47,and what is the price of this
47,this one just about the body on me it's $2000
47,that's pretty expensive okay let me look at some other cameras. For example. is this a Nikon Coolpix S 2800 is this the newest and the price what is the price on this
47,this one is only $68
47,okay $68 pretty good price. and how many megapixels does it have
47,I am not sure… 30 maybe.
47,good good good and it has the optical zoom
47,it has 700 of zoom.
47,okay and what kind of manual settings does it have
47,yes. It is semi manual. You can try it.
47,okay okay okay thank you
47,you are welcome
48,hello how can I help you today
48,yes can you explain this camera nikon to me
48,yes this one is a point and shoot camera perfect for beginner users and it has 18 pieces
48,okay I'm looking for a camera for my wife and she's not very good with a camera but I know a lot about cameras but she doesn't is this good for beginners
48,this one is really good for a beginner it though so just it's setting
48,K and what is the glamour retouch effect
48,"yes, it is only black"
48,good that's a good effect okay how about the optical zooms
48,it has optical zoom of 1000
48,okay thank you let me look at some other cameras. Maybe this sony. How much about
48,this one cost $550
48,$550 a little more expensive for my wife how many colors does it come in
48,colors silver white and black
48,K and do what manual settings what are the manual settings on this
48,it has full manual control so you can control the aperture in the focus of the camera
48,good okay well let me take this catalog with me and I will come back and give you my answer
49,hello
49,good morning
49,excuse me could you explain this camera to me
49,this is a Canon EOS 5d
49,what is the price of it
49,it cost 1000 dollars.
49,when and how much does the or what is the long exposure on this
49,it has 20 seconds
49,what is the iso setting on it
49,it has 4000 iso
49,okay thank you let me think about that
49,excuse me you have two other cameras which is cheapest
49,this nikon is the cheapest
49,and what is the price on this
49,68 dollars
49,and this is a fully automatic camera
49,"yes, it is."
49,and the manual settings how many manual settings does it have
49,it has only 3 manual settings.
49,very much okay let me take a take my ideas to my wife and find out thank you
49,you are welcome
50,I'm looking for a camera that will take automatic pictures
50,I recommend you this nikon over there for all automatic settings camera
50,okay and what is how many colors do you have on this camera
50,five colors for this camera pink black silver and purple
50,okay and what's the weight
50,it's very light is just 120 grams
50,and what's the price on it
50,this camera costs $68
50,68 dollars thats great. What about the optical zoom
50,for this camera goes into 5 times optical zoom
50,thank you very much I'll let me let me talk to my wife and come back and buy a camera
50,very much okay let me take a take my ideas to my wife and find out thank you
51,yes I'm looking for a camera but I don't know anything about cameras so I need you to explain to me about what this sony camera is about how many colorss do you have
51,this color of this camera comes in three colors color white and black
51,OK and how much does it weigh
51,it weighs 470 grams
51,and what is the artistic effect mode on this camera
51,there are 5 artistic effects.
51,okay how about the price
51,this one cost 550 dollars
51,550 dollars Lil bit pricey for I don't know too much about cameras so do you have anything cheaper
51,yes we do I can show you this nikon
51,how many colors does this camera come in
51,colors pink black silver and purple
51,okay good and the price on this camera
51,this one cost $68. Dollars
51,a dog that's a big difference from that one over there okay and manual settings how many manual settings does it have I don't know what is a manual setting
51,this one has Limited manual settings menu settings to set the aperture and focus but it has 18 preset modes
51,18 preset modes good I don't know I'll have to study about that
51,and you recommend this camera
51,for a beginner user I recommend this camera
51,thank you I'll take it
51,thank you so much
52,may I help you
52,I'm looking for a camera but I don't exactly know what kind of camera I'm looking for
52,this sony one has auto mode and manual mode. do you want to automatic settings camera
52,yes I'm going to cameras but to the new digital cameras are not good at
52,you are an experienced user you can take a look at this one because he has 9 different presidents
52,how much is this camera
52,this one it costs $550
52,okay 500 $50 a little pricey for me you have anything cheaper
52,"yes, ve have this nikon but with limited manual settings"
52,okay that's the drawback okay and he comes here with optical zoom
52,it comes with 5x optical zoom
52,what's the price on this again
52,this one is $68 you don't leave
52,hey. It's okay good okay thank you very much
52,thank you for coming to our store
52,welcome goodbye
53,good afternoon sir how can I help you today
53,I'm looking for a camera
53,what kind of camera are you looking for
53,something that is not too expensive but not really cheap
53,I can recommend you this sony
53,$550 that's not too bad how many colors does this come in
53,this camera comes in three colors white silver and black
53,okay and you have what's the weight of this camera
53,the weight of this camera is 470 grams
53,and the autofocus points
53,discover one 179 focus points
53,okay well let me think about that okay thank you very much
53,you're welcome
54,hello
54,how can I help you today I'm looking for
54,I'm looking for an advanced mode camera
54,we have the EOS 5D is a pro camera which you can adjust the settings manually
54,in how many colors does it come in
54,sorry only in one color which is black
54,I see you and what is the weight of this
54,just a body only it weighs 950 grams
54,Focus points how many points does it have
54,it has 61 autofocus points
54,EOS 5D  and how many manual settings does it come in
54,you can sit it has full manual settings you can set the exposure of 30 secs the focus and aperture
54,okay and what is the price on this
54,call me it cost 2000 dollars
55,good afternoon how can I help
55,unless these cameras look so complicated. I'm a bit lost really
55,can I ask what sort of pictures you take
55,yeah of family stuff parties not to embarrassing
55,so you need a camera you can take anywhere use easily
55,that sounds about right now we have to
55,Can you come. This COOLPIX has 20 megapixel sensor so you can do some beautiful enlargements a point-and-shoot camera so it's very easy to use
55,it is like using the phone
55,much simpler
55,that's great do I have to worry about setting things manually
55,18 presets in that you can have some different effects but if you choose your favorites setting that you don't have to change anything
55,alright thanks
55,anything else I can help you with
55,I consider
55,okay thank you have a good afternoon
56,help me 
56,yes how can I help you
56,I would like to know if there are some special features found in this sony camera
56,this one is a mirrorless camera automatically
56,I would like a good camera for me because I'm interested in photography so would you recommend this camera
56,if your new in photography this is good because it also has manual settings so you can also practice the manual settings
56,what about iso
56,3200 ISO
56,which cameras is this canon 
56,that is a full manual DSLR camera
56,is this camera better than the previous one
56,yes it's better
56,and how about the  sensor
56,full frame camera
56,any other color
56,no it comes only in Black
56,"let me take a look at another one, thank you"
56,you're welcome
57,hello I am looking for a camera where it has a you know I'm a nice you know why I so smart because I usually go out at night with my friend so you know. you know why are the cameras so  could you suggest me which one is the best
57,"this sony alpha is an excellent camera takes top quality photographs, the iso is up to 3200. it can take good family photos and in general city low light conditions"
57,how about the shooter speed
57,the shutter speed goes up to 1000 in a second but it can go as low as 30 seconds so you got some creative control if a different effects
57,really I said what about the price
57,this is only $550 to get a full professional camera which would be the nearest you would come for competing with picture quality you'd be four or five times that price
57,I see you know what bike today I just want to roll around so thanks so much for your detailed explanation I will come back because I'm not just going to buy the today so later to talk but thanks so much for your time now
57,anytime come back anytime we can talk about some more things to do with the camera and maybe take it out and give a bit of a gun
57,and what about this canon. It has wide range or is it like a very narrow
57,It goes from 50 ISO  up to 6400 so for the top quality shots on a tripod it's fantastic results a really great in low light
57,and wahat about its sensor.
57,This is a full frame CMOS sensor so it's as big as the sensor get in these regular DSLR's
58,hello good morning
58,hi how can I help
58,I want to look at the new cameras that you have
58,we have three new models in store at the moment we have the full professional model we have the sociable camera for your family and friends we have a semi pro model pictures you take
58,I like to take a good picture of the other insects and plants and everything but I'm still question I miss her so I had no name that's too much
